{
  "schema_version": "3.0",
  "project": "FOX2",
  "dispatch_id": "FOX2-DISPATCH-BRIDGE-DESKTOP-BATCH-B-CODEX-011",
  "dispatch_action": "EXECUTE_LOCAL_AGENT",
  "wp_id": "FOX2-BRIDGE-DESKTOP-BATCH-B",
  "target_agent": "CODEX",
  "workspace_id": "FOX2_LOCAL",
  "dictionary": {
    "version": "1.2",
    "git_path": "docs/governance/FOX2_PROJECT_DICTIONARY_v1.json",
    "git_commit_sha": "92bd9c82385f05893d9379c00f964760e9fe06dc",
    "sha256": "7fc3532890f4a60a4abc7bf3b08dc06fe6af6ee000176ac464bfe3aacda2ecd7"
  },
  "policy": {
    "version": "1.8.9",
    "sha256": "cc0cd2afb482f6af90c9c5e78536c65cecba3d909223a7a27b3d5b3dc374a782",
    "git_path": "docs/governance/FOX2_POLICY_V1.8.9.md",
    "git_commit_sha": "92bd9c82385f05893d9379c00f964760e9fe06dc"
  },
  "task": {
    "path": "docs/agent_handoff/FOX2-BRIDGE-DESKTOP-BATCH-B/task.md",
    "commit_sha": "92bd9c82385f05893d9379c00f964760e9fe06dc",
    "sha256": "ecea6438e322eef000cbb3c4573af31676f5448a91b06e969bf74d07b5ac89ec"
  },
  "prompt": {
    "path": "docs/agent_handoff/RECOVERY/FOX2-BRIDGE-FINAL-CERTIFICATION-011.md",
    "git_commit": "ebb841afd47a1f41dcb03a4f5c7a114e203cdb1a",
    "git_blob_sha1": "e1e892f30ab36c77ff7b9e7305a68d91dbc7b554",
    "sha256": "2ad27316f2d049baf4dec12161d186adaef6f428ac02f36dbb6dd6a6f61a197d"
  },
  "source": {
    "commit_sha": "92bd9c82385f05893d9379c00f964760e9fe06dc",
    "git_source_ready": "YES"
  },
  "routing": {
    "model_policy": "PINNED",
    "auto_tier": null,
    "model": "gpt-6.1-sol",
    "reasoning_effort": "high",
    "permission_profile": "FULL_ACCESS"
  },
  "execution_path": "MANUAL_LOCAL",
  "delivery_owner": "AGENT",
  "permissions": {
    "code_allowed": true,
    "git_code_push": true,
    "git_report_write": true,
    "git_report_push": true,
    "pr_create": false,
    "merge_allowed": false,
    "production_provider": false,
    "broker_write": false,
    "live": false
  },
  "decision_receipt": {
    "policy_check": "PASS",
    "task_state_check": "PASS",
    "source_binding_check": "PASS",
    "routing_r0_r7": "PASS",
    "assignment_check": "PASS",
    "material_capability_check": "PASS",
    "execution_authorized": "YES",
    "code_allowed": "YES",
    "dev_grant_ref": "Owner directed immediate continuation of final Bridge certification. Controllers 009 and 010 are consumed and must not replay. 010 stopped fail-closed in Phase 0 because an ad-hoc PowerShell process observer matched its own query command line; read-only evidence proved real Tray/Worker counts were both zero, runtime/product source were untouched, and Worker canary 009 stayed unclaimed/unexecuted. Controller 011 authorizes certification-only execution using the pinned self-excluding observer helper 928e8279ac6ca45d9421d5fa3773dd44943008ef / blob 000dc032777cec198f59ddb7d6af049a9d23f1fc / SHA-256 75325a05b79cc97e20811d724bde9f0642376b2b359de68d5d6439b5f97d5792. It binds current report-only task head 92bd9c82385f05893d9379c00f964760e9fe06dc while preserving certified product source 501822a33ef08c7365154913bbc677544856eee5, reuses the same unclaimed canary 009, writes only final011 evidence, and authorizes no agent_bridge/product source mutation."
  },
  "runtime_contract": {
    "repo": "dunglt2505/FOX2",
    "branch": "work/FOX2-BRIDGE-DESKTOP-BATCH-B",
    "worktree": "C:\\Projects\\FOX2-worktrees\\FOX2-BRIDGE-DESKTOP-BATCH-B",
    "base_sha": "92bd9c82385f05893d9379c00f964760e9fe06dc",
    "allowed_code_paths": [],
    "allowed_report_paths": [
      "reports/BRIDGE-DESKTOP-BATCH-B/evidence/final011/**"
    ],
    "required_capabilities": [
      "git",
      "python",
      "pwsh",
      "schtasks.exe",
      "codex_cli",
      "full_access_mode",
      "certified_product_source_501822a33ef08c7365154913bbc677544856eee5",
      "report_only_lineage_final009_final010",
      "pinned_cert_process_observer_011",
      "observer_preclaim_smoke_test_zero_zero",
      "real_certified_bridge_package_installed",
      "real_startup_task_owned_and_enabled",
      "dispatch_001_through_010_consumption_preserved",
      "final009_legacy_canary_unclaimed",
      "final009_canary_branch_exact_base",
      "installed_v3_normalizer_available",
      "git_non_main_push_and_remote_readback"
    ],
    "stop_conditions": [
      "source_branch_worktree_or_prompt_binding_mismatch",
      "501822a_to_92bd9c_contains_non_final009_or_final010_change",
      "observer_helper_blob_or_sha256_mismatch",
      "observer_preclaim_smoke_test_nonzero_or_self_match",
      "worktree_dirty_or_competing_writer",
      "agent_auth_capacity_or_full_access_failure",
      "any_product_source_mutation",
      "any_001_through_010_replay",
      "final009_canary_already_claimed",
      "final009_canary_branch_head_not_exact_base_before_claim",
      "startup_task_ownership_mismatch_beyond_windows_case_equivalence",
      "installed_v3_v2_or_v06_compatibility_failure",
      "real_tray_worker_single_instance_or_graceful_restart_failure",
      "canary_claim_or_agent_execution_failure",
      "agent_substitution_or_configuration_mismatch",
      "result_publication_or_remote_readback_failure",
      "secret_private_or_sensitive_data_exposure",
      "changed_path_allowlist_or_git_diff_failure",
      "main_pr_merge_deploy_provider_broker_or_live_action"
    ]
  },
  "required_tests": [
    "CERT_PROCESS_OBSERVER_SELF_EXCLUSION",
    "STARTUP_SINGLE_INSTANCE",
    "INSTALLED_TRAY_WORKER",
    "SANITIZED_DIAGNOSTICS_BUNDLE",
    "PROJECT_DICTIONARY_BINDING",
    "DISPATCH_V3_SCHEMA_BINDING",
    "DISPATCH_V3_STRUCTURAL_CONFORMANCE",
    "DISPATCH_V3_RUNTIME_COMPATIBILITY",
    "V2_COMPATIBILITY",
    "V06_COMPATIBILITY",
    "REAL_ELIGIBLE_FOX2_DISPATCH",
    "EXACT_AGENT_CONFIGURATION",
    "FULL_ACCESS_PERMISSION",
    "RESULT_REMOTE_READBACK",
    "USAGE_SNAPSHOT",
    "RESTART_NO_REPLAY",
    "CHANGED_PATH_ALLOWLIST",
    "SECRET_SCAN",
    "GIT_DIFF_CHECK"
  ],
  "created_by": "CHAT",
  "created_at": "2026-10-15T07:22:00Z",
  "max_runs": 1,
  "retry_of_dispatch_id": "FOX2-DISPATCH-BRIDGE-DESKTOP-BATCH-B-CODEX-010"
}
